{
  "$schema": "https://json-schema.org/draft/2020-12/schema",
  "title": "WISDO Blender Bridge Job",
  "type": "object",
  "additionalProperties": false,
  "required": ["assetId", "assetType", "source", "output", "report"],
  "properties": {
    "assetId": {"type": "string", "minLength": 1, "maxLength": 80},
    "name": {"type": "string", "maxLength": 80},
    "assetType": {"enum": ["character", "arcade", "building", "vehicle", "vegetation", "prop"]},
    "source": {
      "type": "object",
      "additionalProperties": false,
      "properties": {
        "repoPath": {"type": "string"},
        "url": {"type": "string", "format": "uri"},
        "filename": {"type": "string"},
        "recipe": {"type": "string"}
      },
      "oneOf": [{"required": ["repoPath"]}, {"required": ["url"]}, {"required": ["recipe"]}]
    },
    "output": {"type": "string", "pattern": "^public/world-assets/.+\\.glb$"},
    "report": {"type": "string", "pattern": "^(public/world-assets|tools/blender/reports)/.+\\.json$"},
    "registerTarget": {"enum": ["none", "playerV2", "arcadeV2", "npc", "building", "prop", "vehicle", "interior", "vegetation", "worldObject"]},
    "targetHeight": {"type": "number", "exclusiveMinimum": 0, "maximum": 500},
    "lodRatios": {
      "type": "array",
      "minItems": 1,
      "maxItems": 6,
      "items": {"type": "number", "exclusiveMinimum": 0, "maximum": 1}
    },
    "license": {"type": "string", "maxLength": 120},
    "sourceNote": {"type": "string", "maxLength": 300},
    "clips": {"type": "object"}
  }
}
